Author,Review,Review Date
patsweb,"This Samsung tablet replaced an older Samsung tabS 10""model. I am a heavy user of my tablets, so I decided to update to this newer model. My older tablet was Amoled, and though this one isn't, I really don't notice the difference. This one is a bit larger, but I also prefer larger screens with my senior vision issues. I play games like Township and Terra Nil, which both work great on this tablet with the extra ram. I mostly have quit using my lap top. As I using this tablet all long, watching utube and Netflix, I decided that I needed to buy a more durable n protective case than the one that originally came with it, just in case I dropped it. Unfortunately, I can no longer use the finger print sensor(it is covered by the new case), and the face recognition doesn't work that well for me. My one change would be for Samsung to add finger print sensor to the screen as an option.

The charge holds most of the day for me with all day use, but I will usually put it on the ""fast charger"" after about 6 hrs. I like the battery safety feature that will stop it from over charging, as that may have been a problem with my older tablet.

I always used some sort of stylus pens for my tablets, but have never had a tablet that I could actually write/draw on and really didn't think that I needed that feature. But, it has proved very useful once I figured out how to use Samsung notes. I don't think that I would ever buy another tablet without this feature, as I have been able to eliminate most of my paper notes...love using this! I haven't used the pen to draw with, but like to take notes on all my craft projects, etc. I can even insert photos into my notes. My only wish was that I had this when I was in school many years ago, though I would probably have ordered a smaller size for that purpose. This large size is perfect for watching movies and playing games at home. If this tablet lasts as long as my older Samsung, I will be very pleased.","Reviewed in the United States on January 11, 2024"
villanova,"This tablet is amazing!! Yes amazing. I was coming from a Samsung Galaxy Tab S7 11 inch. And that thing was fast,even in present day. But it got damaged in the field. I use my tablet for business work. Got the S9 FE. I didn't want to buy another flagship (S9 series) because they were more expensive and for my needs the S9 FE served me well.It is still smooth and quick. Not quite as fast as the flagships, but not slow or smooth. Everything that I did on my S7, I am able to do here. Only one issue I have with this tablet is that you can't plug it into an external monitor, which I could before on my S7. But other that that this tablet is amazing and I highly recommend to anyone who wants most of the premium features of the flagship tablets, but don't want to spend the cost for those.","Reviewed in the United States on March 21, 2024"
John Galt 2021,"Updates will be posted on the top.

Update #3 12/07/23
My FE just got Android 14 with U.I. 6.0 Quick download and install no problems.

Update #2 10/30/23

I noticed one reviewer said they can't stream to their projector with this tablet as it runs slow. One thing I noticed about this tablet, and it is probably more the software is that out of box it appears apps are default set to run in the ""strict power saving"" mode. i accidently noticed this when I had trouble audio streaming via an app. So, I changed the power saving mode to ""optimizzed' and everything worked fine.

Update #1 - 10/19/23.
I charged the device from 19% to 85% (Samsung's recommended limit) using the Samsung 45-watt charger. It took 50 minutes. The same charge on my Tab A8 takes about 3.25 hours.

It came a day early. The packaging was excellent.

I also have a Tab A7 and Tab A8. I purchased the Tab S9 FE 10.9"" to replace the Tab A7 which stopped Android updates with Android 12.

I also purchased Samsung's 45-watt charger. The battery was at 51%. I charged it to 91%, I didn't watch the clock so I don't know exactly how long it took but it was quick. I then used Samsung Flow used be Samsung Switch to copy my apps and data from the Tab A8. The Tab S9 came with a cable to I was able to use the wired method for the copying. it went pretty quick.

All the apps except two copied. One for some reason is not compatible with the S9. The other I was able to install from Google Play. After that I spent a Few hours organizing my home screen with Microsoft Launcher and signing in and testing my music apps. The audio is okay but when I connected the tablet to one of Sound Core Bluetooth-Speakers I had to turn the volume down to under 25%.

The S9 FE is definitely faster than the Tab A8. At one time I had about a half dozen apps open without a problem. The extra .4"" in the display over the A8 is nice. The tablet is definitely bright enough, I am keeping the brightness settings at about 10%.

I haven't tried any games since I don't play them. I did check the download and upload speed and it was basically the same as the Tab A8 which is fine for me.

As far as the OS goes. It came with Android 13 and Samsung U.I 5.1.1. However, the Android security update was Aug 1st. I imagine it will update soon enough. Google Play was June 2023. It took three restarts to bring it up to September which is a Google issue.

That is it for now. I will post an update or two to this once I get more battery and other information.

Another excellent product from Samsung.","Reviewed in the United States on October 16, 2023"
Ann,The tablet is amazing. It really charges quickly and holds the charge for an extended period of time. The camera is wonderful. I will use it on any trips that I take. I got a zipped covering for it with a strap. I want to use it esp. for panoramic pictures that will be in the making. Highly recommend!!!!!,"Reviewed in the United States on March 29, 2024"
Kat B.,"I'm an engineering major and I used this for note-taking. I love the size and weight and the price is a lot more reasonable than an iPad. Great battery life and it never got too hot. Unfortunately, the os is the dealbreaker for me. Comes with a free copy of Goodnotes pro but the android version is slow, glitchy and has way less features than the iOS version. There are way fewer apps available for Android and the ones that are available are pretty clunky; samsung notes has a lot of great features but is missing some major ones, i.e. page layout and font customization. Maybe in a few years Android will catch up, but as of now the Android app experience just can't compete with iOS.","Reviewed in the United States on February 12, 2024"
Scott Linn,"The tablet is slightly larger than my previous one but quite a bit heavier, probably the larger battery. Nice screen. Performance is good. Very pleased with my purchase.","Reviewed in the United States on April 3, 2024"
Bree,Great for drawing watching movies ECT .sounds decent. love the operating system . Screen shows very clear . I Just put sim card in it an it activated it's self . Very thin pen is decent size not skinny . I LOVE IT,"Reviewed in the United States on March 30, 2024"
Andy Fox,"I love the fact i can run any two apps in multi-window mode with ease, including ones otherwise memory hogging, lol. I cannot say enough good about this tablet, dont know what to say so i will state my only gripe: It wont connect to wifi 5g speeds. Meaning I have a 500mbs connection but never get more than 350mbs on the tablet two feet from the router. On my computer 3 rooms away, i get 450-525mbs. Why is this??? It may be the norm for tablets and phones, not sure. I definately recommend this tablet especially for multitasking.","Reviewed in the United States on April 6, 2024"
Anon,"I was so excited to try this tablet for my art, as Android has a ton of things that make for an efficient workflow including air gestures (with the S-Pen Pro, not included), air actions, DEX mode, syncing with my Windows computer, and so much more. The mint color is gorgeous, and I loved everything about the tablet... except that it couldn't do the ONE thing I bought it to do.

It worked fine at first, but then I noticed there was an extreme delay in gestures when switching from pen to gesture, and sometimes just wouldn't work at all. This happened in my Clip Studio app as well as others. I spent hours with support for the tablet and with CSP before being forced to factory reset, which somehow solved it... Until I installed the updates.

Turns out, the issue is with OneUI, and hasn't been resolved for years according to the complaints on Reddit dating back to 2022. This delay completely interrupts my workflow, as I can not seamlessly switch from drawing with the pen, to zooming or rotating with my hand.

I had returned the first tablet I got, under the direction of the support desk, only to get a second one, spend hours re-installing my brushes on CSP, only to find the same problem. It's definitely an issue with OneUI.

For everyone else who doesn't care, or who doesn't intend to use it for art, it's 100% fantastic. Bright screen, powerful budget tablet that can do so much more than you think it can.

For artists? I am so sad to claim defeat to the iPad which can do the one thing this one can not: Work.

The straw that broke the camel's back for me is more of an issue with Clip Studio Paint's Android version which does not allow you to access your files in ANY other way except through the cloud, making it absolutely impossible to batch move your files from your tablet's CSP to your desktop, external HD, or other devices. You literally have to manually open each file from the cloud, onto desktop, then save it where you want. Or you have to access the files ONE at a time through the cloud, click an arrow, open the file location, cut the file and paste it where you want. And of course the file location doesn't have ALL your images in one place. it places it within 3 tiers of foldiers for each. individual. file.

So after going through 2 tablets, hours of support, blood sweat and tears, I finally have to call it quits on the Samsung Tablet yet again and switch to the 2x more expensive iPad. I'm so devastated.","Reviewed in the United States on April 4, 2024"
L. Goldstein,"Too soon to say anything about battery life, or value, or durability. Stupid things to aske me to rate after owing it for less than a week.

All I can say is that it works and the Samsung feature to transfer apps and data from an older tablet also worked. I did have to spend maybe 4 hour on the line with Samsung tech support due to their Catch-22 2 factor authentication. It seems that if you don't have a textable smart phone (and I don't) you can only do the REQUIRED 2-factor authentication via pre-generated PINS. BUT .... you can only generate the PINS if you have already passed 2-factor authentication, which needs a smart phone. Are you with me? They do not offer sending a voice message with the secret one-time use PIN to a phone. Noooooo. Only text messaging will do. This is absurd and exceptionally inconvenient. Grrr to Samsung.","Reviewed in the United States on March 22, 2024"
Dar,"Bought refurbished version but it was still pretty good. A nice step up from the junky tablets under $200.

Will say that I expected it to have a SIM card slot since it's supposed to be 5G capable but the card insert didn't have a place for it.

It's also pretty good for digital art drawing with the Samsung pen with great response time, though I have not tested it with anything else. Used Ibis paint app with it.

Would highly recommend a case that holds the pen securely as it can be easy to lose or damage it, and I doubt the S-pen is cheap to replace.

All in all seems like a solid tablet and ya won't break the bank like ya would with an iPad.","Reviewed in the United States on March 14, 2024"
Yadda Yadda,"I owned a Tab A7 for a couple of years and the battery started expanding, pushing the screen outwards. Time to purchase a new tablet before it started a fire. Decided on the Samsung Tab S9 FE+ and have not regretted it. So much faster and a much bigger screen with a vivid display. Only drawback is it's a bit on the heavy side.","Reviewed in the United States on April 7, 2024"
Javier,"Es una muy buena opción llevo 3 meses usándola, laboral, estudiantil y personal es una excelente tablet, no se traba, corre casi todo, mi única queja es que en la descripción indicaba que traía el protector y es mentira solo viene la tablet por unos días la use sin protector pero es mejor con su protector da seguridad y el original viene con el protector del lápiz que es una genialidad","Reviewed in the United States on April 2, 2024"
Erica Heath,"Love the tablet. Perfect for a digital artist. Screen is sensitive for the S pen, so perfect for drawing. Not many updates during shipping so hard to know where it was or when to be around to sign for it. Delivery lady was on time and friendly once the delivery time actually updated. Tablet DID NOT come with the ""book cover"" case that was listed in ""included compenents"" in the ad. They couldn't do anything about it unless I sent the whole thing back and couldn't just send me the book cover or a small credit to turn around and buy my own. Disappointed with that. Good tablet though.","Reviewed in the United States on March 13, 2024"
Barbara Phillips,"Samsung makes great products and this is one, however I needed to return it because I got one that better suited my needs. When I returned it I had to pay $2 for a label then they also subtracted $12.50 for shupping from my return 😠","Reviewed in the United States on April 5, 2024"
Jj,Got the item it was well packaged to get out very nice product so far happy just trying to figure out the insurance that I'm the extra insurance that I bought to cover it that's all,"Reviewed in the United States on March 31, 2024"
Craig Cooper,Arrived early was fine packaged correctly everything has worked as it should no problems at all,"Reviewed in the United States on April 11, 2024"
dimples,This is a great tablet but I needed it for a small business start up and not for everything I needed it for. I was having issues with everything i loaded on it. It might not have been the tablet just me,"Reviewed in the United States on March 26, 2024"
MS,"Me encantó la tableta, funciona de manera rápida, es útil para lo que requiero pero mi única queja es que no funciona para proyectar en HDMI, lo cual es terrible. Soy profesora y pensé que podría usarla para presentar en clase pero no fue así.","Reviewed in the United States on March 19, 2024"
MaryB,I have received the tablet today and it just looks beautiful and perfectly for a student I will definitely recommend 👌,"Reviewed in the United States on April 4, 2024"
angel erazo molina,"me gusto por que mi hija estudiante de medicina le facilita el estudio , la consulta y el entretenimiento y comunicacion","Reviewed in the United States on April 4, 2024"
Rick,Big improvement from my Fire HD 10. Fast and I really like the compatibility with my phone and laptop.,"Reviewed in the United States on April 1, 2024"
Rance,I purchased 2 of these for my wife and I. We used them on a LONG flight to New Zealand from Texas. We was about to download a lot of shows to watch and never had to charge them from start to finish. 16+ hours flight.,"Reviewed in the United States on March 21, 2024"
Keisy Asendra,"Esta tablet es todo lo que buscaba. Es resistente, rápida, el táctil es fantástico, la pantalla se ve con una resolucion excelente, las funciones con el lapiz son de lo mejor y la respuesta es rapida no hay delay. Cumplió todas las expectativas.","Reviewed in the United States on March 16, 2024"
Novey234,I'm loving my new tablet. It was easy to setup and use.,"Reviewed in the United States on April 9, 2024"
Jake,"Performance: So far its been able to handle anything I do without many problems. Im able to use large 4000px + canvas sizes on multiple drawing apps w/o any lag or crashing. Simple editing on 4k videos also isn't a problem. But weirdly, the one thing it struggles on is screen mirroring. It'll disconnect or even out right crash sometimes, it happens often enough that I've stopped using it completely.
Battery: I only charge up to 85% and I still spend 10+ hours drawing with music on in the background without power saving on. The charging is also pretty fast.
Other: I wish the s pen was more comfortable, drawing or writing with it is painful for long periods - it needs a grip. The oem nib is ok, but a textured screen protector + metal nib feels necessary for drawing/writing.","Reviewed in the United States on February 9, 2024"
Yeremy Godoy,"Hello, this review is to mention that I am very happy with the product, but as I understood the cover came in the purchase, but in the box there was no gift cover, luckily I came up with the idea of adding a separate generic cover but it is wrong that the product that includes the cover appears in the images when it is not |","Reviewed in the United States on March 4, 2024"
Alexis Perez,"I'm a teacher, and was looking for something good and inexpensive to use to write on PDF of assignments and test. It is simply amazing. I love it, the S-Pen is amazing, and the Battery Life too.

Drawing is one of my hobbies, so its also really awesome at that too.","Reviewed in the United States on March 13, 2024"
Dent Hales,It's a very nice tablet. I am really enjoying using it.,"Reviewed in the United States on April 7, 2024"
Estefania O,Perfect función and nice imagen.,"Reviewed in the United States on April 11, 2024"
Robert Trezelle,Will be getting one for my daughter,"Reviewed in the United States on April 7, 2024"
Karina,"Muy satisfecha, me encantó","Reviewed in the United States on April 11, 2024"
chellie,"I bought this to be used as a digital planner. I didn't need the fancy stuff and I thought it was too big for my needs as a teacher. I decided to go with the smaller version, the 10.9, because of the price as well. If you are using this for gaming, than this is for you. Otherwise, the smaller one does what I needed and I am happy that I returned this for the smaller version.","Reviewed in the United States on February 18, 2024"
mbender,"I needed a new tablet since my other one had a UI System notification come up. The system was going out after 4 years. This tablet is fast and battery life on it lasts. I play games, music, videos, run cameras, and take credit card payments on it throughout each day. Like any other device, the more you use it, the more the battery drains. I'm usually on it full force for 6 to 7 hours before it let's me know my battery is at 15%. I'm at 50/59 at clearing my apps when I switch from one to the other, I keep a charger next to me all day, and I could get more out of the battery if I was more picky about it.

The pen works very well too. I've noticed I use the pen more on this tablet than any other tablet I've had prior. I got the 256gb on this one and surprisingly enough, I haven't had to delete stuff to make more room. If it had calling and texting on it permanently, I would be on the tablet more than my phone.

I mainly use it on the homes wifi so no need to spend an extra $27 for service on the tablet. If I need wifi connected on this tablet, I just connect it to my cell phone. All our phones have unlimited everything so it pays to use it.","Reviewed in the United States on December 21, 2023"
Tina Hall,"I'm sure the battery life would be better IF I didn't play games on it so much most of the day. Otherwise, it's a fabulous tablet! I just wish they gave me a charging cable instead of the type C to type C cable to switch apps, etc. What a waste of space in the box since I can do that over Wi-fi. I really did not need that cable. I NEED a charging cable! Why would they sell something without a way to charge it???? Extra??? Makes me think ""batteries not included""!!! Come on, Samsung. You can DO BETTER!!! Still love the tablet, though.","Reviewed in the United States on February 14, 2024"
Pinolillo,Q está shido,"Reviewed in the United States on April 7, 2024"
Fernando Molina Guzman,El Performance,"Reviewed in the United States on April 10, 2024"
Julie,"Excelente 👌 envio rapido, justo lo que pedi.","Reviewed in the United States on April 5, 2024"
JOSEPH S.,"I also have the s9 ultra. But wanted something smaller to take with me. It is everything its larger brother is, but in a smaller profile. It is fast and picture quality fantastic. I like the size at 10.9 inch. Also 5g for Verizon.","Reviewed in the United States on March 8, 2024"
Amazon Customer,"Very nice fits perfectly, love it","Reviewed in the United States on April 1, 2024"
Amazon Customer,"El producto en excelentes condiciones, con la calidad característica de Samsung, pero en la descripción de mismo se menciona el case de fábrica que venía como accesorio en la caja junto al cable y el SPEN original, pero a la hora de revisar, la funda protectora de fábrica para la tablet no estaba, habiendo sido mencionada.....😔😔😔","Reviewed in the United States on February 21, 2024"
Steeven,La tablet muy buena y todo. Pero pensé que venía el estuche ya incluído en esa versión y al parecer no. Igual lo recomiendo mucho buena tablet.,"Reviewed in the United States on March 18, 2024"
El Managuita,"I am so glad I got Samsung tablet, instead of IPad's limitations. Works as expected: good picture, excellent computing speed, no crashes, and expansion memory capacity ( 1 terabyte intalled) work seamless with my phone I am able to answer my phone, emails, text messages from my tablet, even it has no phone line installed. GREAT to edit my photos anywhere if I am connected to wifi.","Reviewed in the United States on March 10, 2024"
Steven L. Walters,"I look to Samsung first for the most robust and dependable and utilitarian electronics. May not be as artsy as some others, but that's not what I use them for.","Reviewed in the United States on March 15, 2024"
Allen Fisher,"The size of the tablet (12.5"") provides plenty of space to view any kind of documents. There is a split screen feature that takes advantage of the extra viewing space. The tablet is much easier to hold if you have a case for it. Due to its size, it can be awkward to hold without a case. The processing speed is very good. Downloading is very quick. Battery life is adequate.","Reviewed in the United States on February 21, 2024"
selegear,"Very easy to set up even for an 81 year old lady. Has more features than I will ever use. I love the S-Pen. It is a real great feature! I am a Samsung Lady. Have been using their products (cell phone, TV, Tablet, washing machine, etc.) for a long time and always find they fit my needs. Very dependable. Highly recommend this tablet.","Reviewed in the United States on February 24, 2024"
Joao,"I bought this to my son to replace a Samsung tablet from 2017 that was struggling pretty hard with games like roblox and minecraft. I have to say that I'm very impressed with this tablet even considering it doesn't have a Snapdragon on it! Everything we have thrown at it has worked without any problems, without lowering the gaming experience and or performance. The speakers are also very good for what the tablet costs. I have an iPad Pro M1 and honestly, I found the volume and sound quality to be on par or very close to the iPad. The screen is crispy and smooth, with good definition, contrast and clarity. Very happy with this tablet and needless to say, my son is very very pleased with it.","Reviewed in the United States on February 1, 2024"
Windell Williamson,Good display. Very good battery life. Good range on wi fi compared to other devices I have owned. Screen slightly shiny for book reading but not a significant issue.,"Reviewed in the United States on March 15, 2024"
Tatia Electra quick-scott,It's worth buying!!!,"Reviewed in the United States on March 31, 2024"
LibraryLady,"Very nice tablet. I use to read my books. Very easy to set up, just transferred data automatically from my Galaxy phone. Sort of like a big phone. Only negative charging cord did not have a wall adapter.","Reviewed in the United States on February 27, 2024"
M.T,Great product. No issues and very useful.,"Reviewed in the United States on March 22, 2024"
matachang,"This tablet is just amazing !
The screen deliver great colours, the sound really immersive when watching a movie.
Light, so you can carry it everywhere easily.
The touchpen is great.

The best tab for me.","Reviewed in the United States on March 4, 2024"
craig la croix,"This is the first product that i have owned, in which the battery life is really 18 hours. I would charge my Tablet every 3 days. The picture quality is average and something that i really wish was better","Reviewed in the United States on February 19, 2024"
Pedro Ortegano,"Excelente tablet sin duda alguna. Sólo no doy 5 estrellas puesto a que en las especificaciones decía que venía con un protector tipo libro el cual nunca llegó, tuve que comprar uno aparte","Reviewed in the United States on February 22, 2024"
