Author,Review,Review Date
Constant Shopper,"It was hard to buy this, to me, expensive device.
I use my 2019 A tab all day long. (even though I have a very nice desktop computer and a fancy S22 ultra phone). I read, write, research, play stupid games, shop, watch videos, access my printer, do everything with it.
i\It can't stay connected to wifi 6, ane won't restart correctly. Some sites were not rendering correctly.
So, time for a new tablet.
It seemed like complete overkill to buy this tablet. Don't you think so? But it is a gift, that I was encouraged to accept.
We had a lot of AMEX reward dollars that made it easier to buy now that Amazon accepts them.
I was, again, encouraged to get this big size. It is pretty big. Is that necessary? I doubt it.
So far it runs well. It magically linked with my phone and now is a second phone. Along with my Samsung watch. See, I told you, too much stuff.
To me it charges very slowly. A full charge lasts a long time.
I am slow to get used to new things, but I think I like this device.
Maybe there was a tablet priced between the Tab A and this one. Ok this is the one between the tab A and the S9 tab, I get it.
I like that it is water resistant, but I never dunked the old Tab A.
I bet this new tablet will be $200 off in six weeks.
Oh, well.","Reviewed in the United States on December 20, 2023"
Mandi Oyster,My son wanted this to help him take notes in his college engineering classes. He's super excited about it and loving it so far.,"Reviewed in the United States on March 13, 2024"
Cristhian Mejia,"Tablet does everything I need it to, it is replacing my iPad Air2 from 2015 since iOS 15 crippled the still useful thing. It is now relegated to my content machine. I use this for work where I pair to my phone for emails, messaging, and network sites and PDF viewing. I work in aviation.","Reviewed in the United States on February 19, 2024"
Daniel Salcedo,"La compré para trabajo (diseño) y hasta el momento todo bien, es un buen equipo!!!","Reviewed in the United States on March 20, 2024"
Monica,"Muy útil, práctica, tamaño y peso perfectos. Súper recomendada.
Llego muy rápido","Reviewed in the United States on March 15, 2024"
Jack of all trades,"It has tons of real estate, upgradeable memory via MicroSD up to 1TB, it is thin and lightweight.","Reviewed in the United States on March 19, 2024"
Daniel Liboa,Muy buen producto,"Reviewed in the United States on March 19, 2024"
eddie tesson,Excelente condición. La obtuve buen precio 👍,"Reviewed in the United States on March 17, 2024"
Not as tough as a Casio. Should have known by the price.,Work and home.,"Reviewed in the United States on March 17, 2024"
Germillie,"Me encanta mucho, hermosa.","Reviewed in the United States on March 15, 2024"
Christa,I wanted a big screen and this was perfect runs smooth and connected to my phone so easy,"Reviewed in the United States on March 6, 2024"
Mike Spans,Great product through and through.,"Reviewed in the United States on March 15, 2024"
DB,"My wife and I each got one of these. All the processing power and storage we need for daily internet browsing.
Colorful screen. Speakers are adequate.
Large screen compared to 10.1s I have had before.","Reviewed in the United States on March 3, 2024"
Kesean,"I say this tablet is excellent plus really good at reasonable price & great for those people don't had money buy or don't wanted spend 800, 900 or 1000 dollars for tablet.
It had some features like full flagship tablet of Samsung tab s9, it had dex mode which can use like a laptop & come with s pen the speakers are loud enough watch videos and movies.
Tab s9 fe also had fingerprint Censor.
I Like how samsung give us options buy different colors of tab s9 fe unlike tab s9 only came with 2 color options.
Camera are good enough to take pictures and recording videos.
Samsung galaxy tab s9 fe is water & dust resistant so don't had worry about when it raining or getting dust on your tablet basically take with you everywhere.
There 5g options for this tablet now can.
Down side with tablet there no snapdragons chip inside of tab s9 fe at least samsung Optimize their chip so won't overheat y
The tablet.
Yet don't mind some Sacrifice of the features still worth buying.","Reviewed in the United States on October 30, 2023"
Jack Rickey,I like that I can take notes on this tablet and save it across all my Samusung Devices to review later.,"Reviewed in the United States on March 4, 2024"
ZK,"Good tablet, definitely better on my eyes than my older 8 inch tablet. I thought when I was researching this tablet that it supported wifi 6, but that is not the case. I have wifi 6 turned on and this tablet is unable to see it. Too bad, but still a nice tablet though I wish I could have bought it without the S pen that I will never use.

Okay, so it looks like it does support wifi 6 as there is a little '6' next to the wifi symbol, but it does not support wifi 6E 6ghz band. I bought a USB wifi 6E adapter and that worked as it should and detected the 6ghz band.","Reviewed in the United States on December 1, 2023"
Natalia V,"Me ha encantado! Por el precio es una excelente tablet, todo ha funcionado muy bien","Reviewed in the United States on March 5, 2024"
rick christensen,I have nothing but good to say about my new tablet. It's everything I wanted and was easy to set up.,"Reviewed in the United States on February 29, 2024"
Hassan Salameh,"Screen isn't crazy good, but its fine","Reviewed in the United States on February 17, 2024"
Dan,very nice,"Reviewed in the United States on March 14, 2024"
Linda Felton,I love the keyboard has large alphabet and numbers. Makes it so easy for me,"Reviewed in the United States on March 3, 2024"
Donna,The size is perfect for reading books and the battery lasts a long time.,"Reviewed in the United States on February 28, 2024"
edder,"Me ha funcionado perfectamente, la uso para editar fotos y videos y lo hace sin ningun problema, tambien le doy uso en mi trabajo en IT y es super versatil, y me ha servido como segundo monitor para presentar informacion de manera mas facil y fluida, es una lastima q no tenga salida de video debida q es USB 2.0, pero con screen share algo se hace. Full recomendada, aunque si tienen un poco mas de $$$ la FE+ o la S9 seria mejor.","Reviewed in the United States on January 22, 2024"
Cheynne,Works great the pen attaches in more than one spot which a love! I have had no issues with it. Took it on a road trip battery lasts a long time which is nice. Make lists and do homework on it.,"Reviewed in the United States on February 13, 2024"
Amazon Customer,"Slick. Easy on the eyes, and the wallet","Reviewed in the United States on February 27, 2024"
Ryan,"Says ""whats in the box"" : Tablet Cover Case. Never got it. But absolutely love the tablet. Recommend 10/10","Reviewed in the United States on February 20, 2024"
amorerar,"Contenido de la caja
Funda de libro inteligente.
No llego la funda es conveniente se revise mejor los artículos antes de ser enviados.","Reviewed in the United States on January 24, 2024"
Eficiente y rápida entrega,"Play Video
💯Excelente producto, un poco insatisfecha con la poca protección de la mercancía...😕 pueden mejorarlo...🤝Gracias de todas maneras!🙏","Reviewed in the United States on February 20, 2024"
Ebony,I got this for my 11yr old son for his birthday. it was delayed for a week but finally came and is running great!,"Reviewed in the United States on January 22, 2024"
Kristine Marsee,I really have been enjoying my new tablet. I wanted something with a pen so I can do more digital notes for various things like school and genealogy. So far it has been good. Be careful with the pin number! I didn't realize samsung erases everything if the pin code is forgotten. So now I'll probably have to factory reset and lose all my notes!,"Reviewed in the United States on April 10, 2024"
Nic B,Love it still learning more about the features 😁,"Reviewed in the United States on February 26, 2024"
Keith Henderson,"I wanted to get a tablet to use for sheet music and replace my binder of paper sheets.

It was very easy to start and set up.

So far, no issues. I which it came with a wall charger which I had to buy separately.","Reviewed in the United States on February 2, 2024"
Dave,"Display is crisp and very clear, colors on screen are very vivid. Processors are very fast for all of the tasks I ask of it. One speaker on each end equals very nice sound. The OS upgraded to Android 14 One UI 6.0 immediately upon plugging it into my wireless network. The OS takes up 15.28GB of space. Even after loading all of my apps, I still have 97+GB of free space. It is heavier than my 4 year old Galaxy Tab A 10.1 (2019), but I can still hold it with one hand for quite a while before fatigue sets in. I view this tablet as a very nice computer for the $$$ I spent on it. I believe I made a better choice than picking the Galaxy Tab A9+. Without a cover it can be a little slippery.","Reviewed in the United States on December 21, 2023"
Kenny Diaz,Muy buena tablet,"Reviewed in the United States on February 29, 2024"
john j lucasr jr,"personal use, very good product","Reviewed in the United States on February 24, 2024"
Douglas Cahill,"Samsung S9fe is a good reasonably priced 10.9"" tablet. I got the 256gb and installed a 512gb micro sd card. So I have plenty of space. My only complaint is that there's no case available except directly from Samsung. Amazon has been ""out of stock"" for a while. I do like the Spen, it's a real benefit. (I have swollen fingers), it's also a large enough circumference to hold comfortably. All in all I'm pleased. The data transfer from my old A7 to this went smoothly. I used the provided cable to connect both together and almost everything transferred, that's simply a extremely minor annoyance. (2 games) All in all, I'm a happy camper.","Reviewed in the United States on October 23, 2023"
Amazon Customer,These work great. They're a little dark but it's OK that you have to try to read the business card inside because nobody needs to see it until they really need to see it.,"Reviewed in the United States on February 4, 2024"
Robert Williams,"I like all of the features, but the wifi range is slower than my S23 cellphone","Reviewed in the United States on January 13, 2024"
Legio jesus,"Recommended, I would buy it again","Reviewed in the United States on February 20, 2024"
Alejandro J. Fúnez,"Its excellent for media and study, the display has good colors.","Reviewed in the United States on February 13, 2024"
clara,"Excelente!
La pantalla es grande!","Reviewed in the United States on February 17, 2024"
Justin R. Voigt,It does everything I want it to do - I was able to connect it to my phone using Bluetooth/tethering and it works well!,"Reviewed in the United States on February 5, 2024"
Nina,No soy fun Samsung pero mi mejor tablet desde siempre incluso mejor que ipad. La recomiendo 🥰,"Reviewed in the United States on February 5, 2024"
Fawaz Ajibola Adebayo,While it’s not built for gaming it does handles all other things efficiently,"Reviewed in the United States on February 5, 2024"
Robbinse,"Well worth the $$$. Had purchased a Chromebook 2 360, and couldn't get it to connect or sync. Contacted Samsung directly, actually found out difference between tablet and laptop, and this tablet is AMAZING! Zero problems connecting and setting up. Very easy and quick. Also ordered the Samsung Keyboard Case Cover & Screen Protector. Can't say enough... very impressed, and it's expandable, and yes it syncs immediately with your phone and other products. Thank you!!!!!","Reviewed in the United States on January 13, 2024"
"The device is very sophisticated, functions very well under extreme pressure","I like it's practicality and design. Especially for students, this is a must get!","Reviewed in the United States on February 4, 2024"
